{
  "$schema": "https://json-schema.org/draft/2020-12/schema",
  "$id": "https://bookmarks.getbible.net/schema/api/topic.schema.json",
  "title": "v1/topics/<id>.json",
  "type": "object",
  "additionalProperties": false,
  "required": [
    "schema_version",
    "id",
    "name",
    "color",
    "aliases",
    "default",
    "names",
    "verses"
  ],
  "properties": {
    "schema_version": {
      "const": 1
    },
    "id": {
      "type": "string",
      "pattern": "^[a-z0-9]+(?:-[a-z0-9]+)*$",
      "maxLength": 80
    },
    "name": {
      "type": "string",
      "pattern": "^[A-Za-z0-9][A-Za-z0-9 &'():?-]*[A-Za-z0-9)]$",
      "maxLength": 80
    },
    "color": {
      "type": "string",
      "pattern": "^#[0-9a-f]{6}$"
    },
    "aliases": {
      "type": "array",
      "maxItems": 20,
      "uniqueItems": true,
      "items": {
        "type": "string",
        "pattern": "^[A-Za-z0-9][A-Za-z0-9 &'():?-]*[A-Za-z0-9)]$",
        "maxLength": 80
      }
    },
    "default": {
      "type": "boolean"
    },
    "names": {
      "type": "object",
      "propertyNames": {
        "type": "string",
        "pattern": "^[a-z]{2,3}(?:-[a-z0-9]{2,8})*$",
        "maxLength": 16
      },
      "additionalProperties": {
        "type": "string",
        "minLength": 1,
        "maxLength": 120
      }
    },
    "verses": {
      "type": "array",
      "maxItems": 100000,
      "items": {
        "type": "array",
        "minItems": 3,
        "maxItems": 3,
        "prefixItems": [
          {
            "type": "integer",
            "minimum": 1,
            "maximum": 66
          },
          {
            "type": "integer",
            "minimum": 1,
            "maximum": 150
          },
          {
            "type": "integer",
            "minimum": 1,
            "maximum": 2000
          }
        ],
        "items": false,
        "description": "Translation-independent [book, chapter, verse] in the 66-book Protestant canon."
      }
    }
  }
}
