{
  "schema_version": 1,
  "id": "dietary-guidance",
  "name": "Dietary Guidance",
  "color": "#bef264",
  "aliases": [],
  "default": true,
  "names": {
    "af": "Dieetriglyne",
    "ar": "التوجيه الغذائي",
    "br": "Sturioù boued",
    "ch": "Guiya i Neñkanu'",
    "chr": "Dietary Guidance",
    "cop": "التوجيه الغذائي",
    "cs": "Pokyny ke stravování",
    "cu": "Наставления о питании",
    "da": "Kostvejledning",
    "de": "Ernährungsrichtlinien",
    "el": "Διατροφική καθοδήγηση",
    "en": "Dietary Guidance",
    "enm": "Dietary Guidance",
    "eo": "Dieta Gvido",
    "es": "Orientación alimentaria",
    "et": "Toitumisjuhised",
    "eu": "Orientazio dietetikoa",
    "fi": "Ruokavalio-ohjeet",
    "fr": "Conseils alimentaires",
    "gd": "Stiùireadh daithead",
    "got": "Ernährungsrichtlinien",
    "grc": "Διατροφική καθοδήγηση",
    "gv": "Stiurey bee",
    "hbo": "הדרכה תזונתית",
    "he": "הדרכה תזונתית",
    "hr": "Dijetetske smjernice",
    "hu": "Táplálkozási útmutatás",
    "hy": "Սննդակարգի ուղեցույց",
    "it": "Indicazioni alimentari",
    "ja": "食生活の指針",
    "ko": "식생활 지침",
    "la": "Praecepta alimentaria",
    "lt": "Dietos gairės",
    "lv": "Uztura norādījumi",
    "mg": "Torolàlana momba ny sakafo",
    "mi": "Arataki Kai",
    "mlf": "Dietary Guidance",
    "mn": "Хоолны заавар",
    "my": "အစားအသောက်လမ်းညွှန်",
    "nb": "Kostholdsveiledning",
    "nd": "Iinqophiso zokudla",
    "nl": "Voedingsrichtlijnen",
    "nn": "Kosthaldsrettleiing",
    "pl": "Wskazówki żywieniowe",
    "pon": "Dietary Guidance",
    "pot": "Dietary Guidance",
    "ppk": "Panduan Diet",
    "prs": "راهنمایی رژیم غذایی",
    "pt": "Orientação alimentar",
    "rmq": "Orientación alimentaria",
    "ro": "Îndrumări alimentare",
    "ru": "Наставления о питании",
    "sn": "Nhungamiro pamusoro pezvokudya",
    "sq": "Udhëzime dietike",
    "sr": "Смернице за исхрану",
    "sv": "Kostråd",
    "sw": "Mwongozo wa Chakula",
    "syr": "التوجيه الغذائي",
    "th": "แนวทางด้านอาหาร",
    "tl": "Patnubay sa Pandiyeta",
    "tlh": "Dietary Guidance",
    "tpi": "Gaidens long Kaikai",
    "tr": "Diyet Rehberliği",
    "tsg": "Patnubay sa Pandiyeta",
    "uk": "Настанови щодо харчування",
    "vi": "Hướng dẫn ăn uống",
    "zh": "饮食指引",
    "zh-hans": "饮食指引",
    "zh-hant": "飲食指引"
  },
  "verses": [
    [1, 1, 29],
    [1, 9, 3],
    [1, 9, 4],
    [18, 36, 31],
    [19, 104, 14],
    [19, 104, 15],
    [19, 136, 25],
    [19, 141, 4],
    [19, 145, 15],
    [19, 145, 16],
    [20, 23, 1],
    [20, 23, 2],
    [20, 25, 27],
    [40, 6, 25],
    [40, 6, 26],
    [40, 15, 11],
    [42, 7, 22],
    [42, 7, 33],
    [42, 7, 34],
    [42, 10, 7],
    [42, 10, 8],
    [42, 12, 22],
    [42, 12, 23],
    [46, 8, 8],
    [46, 8, 13],
    [46, 10, 23],
    [46, 10, 24],
    [46, 10, 25],
    [46, 10, 26],
    [46, 10, 27],
    [46, 10, 28],
    [46, 10, 29],
    [46, 10, 30],
    [46, 10, 31],
    [46, 10, 32],
    [46, 10, 33],
    [51, 2, 16],
    [51, 2, 20],
    [51, 2, 21],
    [51, 2, 22],
    [51, 2, 23],
    [54, 4, 1],
    [54, 4, 2],
    [54, 4, 3],
    [54, 4, 4],
    [54, 4, 5],
    [54, 4, 6],
    [54, 6, 17]
  ]
}
