{
  "schema_version": 1,
  "id": "jesus-christs-humanity",
  "name": "Jesus Christ's Humanity",
  "color": "#fecaca",
  "aliases": [],
  "default": true,
  "names": {
    "af": "Die menslikheid van Jesus Christus",
    "ar": "إنسانية يسوع المسيح",
    "br": "Denelezh Jezuz-Krist",
    "ch": "I Taotao-ña si Jesukristo",
    "cs": "Lidství Ježíše Krista",
    "da": "Jesu Kristi menneskelighed",
    "de": "Die Menschlichkeit Jesu Christi",
    "el": "Ανθρώπινη φύση του Ιησού Χριστού",
    "en": "Jesus Christ's Humanity",
    "eo": "Homeco de Jesuo Kristo",
    "es": "La humanidad de Jesucristo",
    "et": "Jeesuse Kristuse inimlikkus",
    "eu": "Jesukristoren gizatasuna",
    "fi": "Jeesuksen Kristuksen ihmisyys",
    "fr": "L’humanité de Jésus-Christ",
    "gd": "Daonnachd Ìosa Crìosd",
    "gv": "Dooinneyaght Yeesey Creest",
    "hbo": "אנושיותו של ישוע המשיח",
    "hr": "Ljudskost Isusa Krista",
    "hu": "Jézus Krisztus emberi természete",
    "hy": "Հիսուս Քրիստոսի մարդկային բնություն",
    "id": "Kemanusiaan Yesus Kristus",
    "it": "L’umanità di Gesù Cristo",
    "ja": "イエス・キリストの人性",
    "ko": "예수 그리스도의 인성",
    "la": "Humanitas Iesu Christi",
    "lt": "Jėzaus Kristaus žmogiškoji prigimtis",
    "lv": "Jēzus Kristus cilvēciskums",
    "mg": "Ny maha-olombelona an'i Jesoa Kristy",
    "mi": "Te Tangata a Ihu Karaiti",
    "mn": "Есүс Христийн хүн чанар",
    "my": "ယေရှုခရစ်၏လူသားဖြစ်တော်မူခြင်း",
    "nb": "Jesu Kristi menneskelighet",
    "nd": "Ubuntu bakaJesu Krestu",
    "nl": "De menselijkheid van Jezus Christus",
    "nn": "Jesu Kristi menneskelegdom",
    "pl": "Człowieczeństwo Jezusa Chrystusa",
    "prs": "انسانیت عیسی مسیح",
    "pt": "A humanidade de Jesus Cristo",
    "ro": "Umanitatea lui Isus Hristos",
    "ru": "Человеческая природа Иисуса Христа",
    "sn": "Hunhu hwaJesu Kristu",
    "sq": "Natyra njerëzore e Jezu Krishtit",
    "sr": "Човечанство Исуса Христа",
    "sv": "Jesu Kristi mänsklighet",
    "sw": "Ubinadamu wa Yesu Kristo",
    "th": "ความเป็นมนุษย์ของพระเยซูคริสต์",
    "tl": "Ang Sangkatauhan ni Hesukristo",
    "tpi": "Pasin bilong Jisas Krais",
    "tr": "İsa Mesih'in İnsanlığı",
    "uk": "Людська природа Ісуса Христа",
    "vi": "Nhân tính của Chúa Giê-su Christ",
    "zh": "耶稣基督的人性",
    "zh-hant": "耶穌基督的人性"
  },
  "verses": [
    [23, 7, 14],
    [23, 7, 15],
    [23, 7, 16],
    [23, 9, 6],
    [23, 11, 1],
    [24, 23, 5],
    [24, 23, 6],
    [26, 34, 23],
    [26, 34, 24],
    [40, 1, 1],
    [40, 1, 16],
    [42, 1, 31],
    [42, 2, 7],
    [43, 1, 14],
    [44, 2, 30],
    [45, 1, 3],
    [45, 8, 3],
    [45, 9, 5],
    [48, 4, 4],
    [50, 2, 7],
    [50, 2, 8],
    [54, 2, 5],
    [54, 3, 16],
    [55, 2, 8],
    [58, 2, 14],
    [58, 2, 16],
    [58, 4, 14],
    [62, 4, 2],
    [62, 4, 3],
    [63, 1, 7]
  ]
}
