{
  "schema_version": 1,
  "id": "blessings-and-curses",
  "name": "Blessings and Curses",
  "color": "#fde68a",
  "aliases": ["Blessings & Curses"],
  "default": true,
  "names": {
    "af": "Seëninge en vloeke",
    "ar": "البركات واللعنات",
    "br": "Bennozhioù ha mallozhioù",
    "ch": "Bendision yan Maldision",
    "chr": "Blessings and Curses",
    "cop": "البركات واللعنات",
    "cs": "Požehnání a kletby",
    "cu": "Благословения и проклятия",
    "da": "Velsignelser og forbandelser",
    "de": "Segen und Flüche",
    "el": "Ευλογίες και κατάρες",
    "en": "Blessings and Curses",
    "enm": "Blessings and Curses",
    "eo": "Benoj kaj Malbenoj",
    "es": "Bendiciones y maldiciones",
    "et": "Õnnistused ja needused",
    "eu": "Bedeinkapenak eta Maldizioak",
    "fi": "Siunaukset ja kiroukset",
    "fr": "Bénédictions et malédictions",
    "gd": "Beannachdan agus mallachdan",
    "got": "Segen und Flüche",
    "grc": "Ευλογίες και κατάρες",
    "gv": "Bannaghtyn as mollaghtyn",
    "hbo": "ברכות וקללות",
    "he": "ברכות וקללות",
    "hr": "Blagoslovi i prokletstva",
    "hu": "Áldások és átkok",
    "hy": "Օրհնություններ և անեծքներ",
    "it": "Benedizioni e maledizioni",
    "ja": "祝福と呪い",
    "ko": "축복과 저주",
    "la": "Benedictiones et maledictiones",
    "lt": "Palaiminimai ir prakeikimai",
    "lv": "Svētības un lāsti",
    "mg": "Fitahiana sy ozona",
    "mi": "Nga manaakitanga me nga kanga",
    "mlf": "Blessings and Curses",
    "mn": "Ерөөл ба хараал",
    "my": "ကောင်းချီးများနှင့်ကျိန်ခြင်းများ",
    "nb": "Velsignelser og forbannelser",
    "nd": "Iimbusiso neziqalekiso",
    "nl": "Zegeningen en vervloekingen",
    "nn": "Velsigningar og forbanningar",
    "pl": "Błogosławieństwa i przekleństwa",
    "pon": "Blessings and Curses",
    "pot": "Blessings and Curses",
    "ppk": "Berkah dan Kutukan",
    "prs": "برکت و لعنت",
    "pt": "Bênçãos e maldições",
    "rmq": "Bendiciones y maldiciones",
    "ro": "Binecuvântări și blesteme",
    "ru": "Благословения и проклятия",
    "sn": "Zvikomborero Nekutuka",
    "sq": "Bekimet dhe mallkimet",
    "sr": "Благослови и проклетства",
    "sv": "Välsignelser och förbannelser",
    "sw": "Baraka na Laana",
    "syr": "البركات واللعنات",
    "th": "พระพรและคำสาปแช่ง",
    "tl": "Mga Pagpapala at Sumpa",
    "tlh": "Blessings and Curses",
    "tpi": "Ol blesing na ol tok nogut",
    "tr": "Bereket ve Lanetler",
    "tsg": "Mga Pagpapala at Sumpa",
    "uk": "Благословення і прокляття",
    "vi": "Phước lành và lời nguyền",
    "zh": "祝福与咒诅",
    "zh-hans": "祝福与咒诅",
    "zh-hant": "祝福與咒詛"
  },
  "verses": [
    [1, 12, 3],
    [4, 23, 8],
    [5, 11, 26],
    [5, 11, 27],
    [5, 11, 28],
    [19, 3, 8],
    [19, 119, 21],
    [20, 3, 33],
    [20, 10, 6],
    [20, 10, 22],
    [20, 26, 2],
    [20, 28, 20],
    [21, 10, 20],
    [39, 2, 2],
    [42, 6, 28],
    [45, 12, 14],
    [48, 1, 8],
    [48, 1, 9],
    [48, 3, 10],
    [48, 3, 13],
    [59, 3, 8],
    [59, 3, 9],
    [59, 3, 10],
    [66, 22, 3]
  ]
}
