{
  "schema_version": 1,
  "id": "longevity",
  "name": "Longevity",
  "color": "#d9f99d",
  "aliases": [],
  "default": true,
  "names": {
    "af": "Langlewendheid",
    "ar": "طول العمر",
    "br": "Hirbad",
    "ch": "Lina'la'",
    "cs": "Dlouhověkost",
    "da": "Lang levetid",
    "de": "Langlebigkeit",
    "el": "Μακροζωία",
    "en": "Longevity",
    "eo": "Longviveco",
    "es": "Longevidad",
    "et": "Pikaealisus",
    "eu": "Iraupena",
    "fi": "Pitkäikäisyys",
    "fr": "Longévité",
    "gd": "Fad-beatha",
    "gv": "Bea liauyr",
    "hbo": "אריכות ימים",
    "hr": "Dugovječnost",
    "hu": "Hosszú élet",
    "hy": "Երկարակեցություն",
    "id": "Umur panjang",
    "it": "Longevità",
    "ja": "長寿",
    "ko": "장수",
    "la": "Longaevitas",
    "lt": "Ilgaamžiškumas",
    "lv": "Ilgmūžība",
    "mg": "Faharetana",
    "mi": "Te ora roa",
    "mn": "Урт наслалт",
    "my": "အသက်ရှည်ခြင်း",
    "nb": "Lang levetid",
    "nd": "Ukuphila isikhathi eside",
    "nl": "Lange levensduur",
    "nn": "Lang levetid",
    "pl": "Długowieczność",
    "prs": "طول عمر",
    "pt": "Longevidade",
    "ro": "Longevitate",
    "ru": "Долголетие",
    "sn": "Kurarama kwenguva refu",
    "sq": "Jetëgjatësia",
    "sr": "Дуговечност",
    "sv": "Livslängd",
    "sw": "Maisha marefu",
    "th": "อายุยืน",
    "tl": "Kahabaan ng buhay",
    "tpi": "Longpela laip",
    "tr": "Uzun ömür",
    "uk": "довголіття",
    "vi": "Trường thọ",
    "zh": "长寿",
    "zh-hant": "長壽"
  },
  "verses": [
    [2, 20, 12],
    [5, 5, 33],
    [5, 11, 21],
    [5, 25, 15],
    [5, 32, 46],
    [5, 32, 47],
    [11, 3, 14],
    [18, 5, 26],
    [19, 34, 12],
    [19, 34, 13],
    [19, 34, 14],
    [19, 91, 14],
    [19, 91, 15],
    [19, 91, 16],
    [20, 3, 1],
    [20, 3, 2],
    [20, 4, 10],
    [20, 4, 20],
    [20, 4, 21],
    [20, 4, 22],
    [20, 9, 10],
    [20, 9, 11],
    [20, 10, 27],
    [20, 11, 19],
    [20, 12, 28],
    [20, 16, 31],
    [20, 19, 23],
    [20, 28, 16],
    [23, 65, 22],
    [26, 20, 11],
    [26, 33, 19],
    [38, 8, 2],
    [38, 8, 3],
    [42, 10, 27],
    [42, 10, 28],
    [45, 10, 5],
    [48, 3, 12],
    [49, 6, 2],
    [49, 6, 3],
    [51, 2, 20],
    [51, 2, 21],
    [51, 2, 22],
    [51, 2, 23],
    [54, 4, 8],
    [60, 3, 10],
    [60, 3, 11],
    [60, 3, 12]
  ]
}
