{
  "schema_version": 1,
  "id": "effective-prayer",
  "name": "Effective Prayer",
  "color": "#c4b5fd",
  "aliases": [],
  "default": true,
  "names": {
    "af": "Doeltreffende gebed",
    "ar": "صلاة فعالة",
    "br": "Pedenn efedus",
    "ch": "Tinayuyot ni' Efekto",
    "chr": "Effective Prayer",
    "cop": "صلاة فعالة",
    "cs": "Účinná modlitba",
    "cu": "Действенная молитва",
    "da": "Virkingsfuld bøn",
    "de": "Wirksames Gebet",
    "el": "Αποτελεσματική προσευχή",
    "en": "Effective Prayer",
    "enm": "Effective Prayer",
    "eo": "Efika Preĝo",
    "es": "Oración eficaz",
    "et": "Tõhus palve",
    "eu": "Otoitz eraginkorra",
    "fi": "Vaikuttava rukous",
    "fr": "Prière efficace",
    "gd": "Ùrnaigh èifeachdach",
    "got": "Wirksames Gebet",
    "grc": "Αποτελεσματική προσευχή",
    "gv": "Padjer breeoil",
    "hbo": "תפילה יעילה",
    "he": "תפילה יעילה",
    "hr": "Učinkovita molitva",
    "hu": "Hatékony ima",
    "hy": "Արդյունավետ աղոթք",
    "it": "Preghiera efficace",
    "ja": "効果的な祈り",
    "ko": "효과적인 기도",
    "la": "Oratio efficax",
    "lt": "Veiksminga malda",
    "lv": "Efektīva lūgšana",
    "mg": "Vavaka mandaitra",
    "mi": "Inoi whai hua",
    "mlf": "Effective Prayer",
    "mn": "Үр дүнтэй залбирал",
    "my": "ထိရောက်သောဆုတောင်းခြင်း",
    "nb": "Effektiv bønn",
    "nd": "Umthandazo ophumelelako",
    "nl": "Effectief gebed",
    "nn": "Effektiv bønn",
    "pl": "Skuteczna modlitwa",
    "pon": "Effective Prayer",
    "pot": "Effective Prayer",
    "ppk": "Doa yang Efektif",
    "prs": "دعای موثر",
    "pt": "Oração eficaz",
    "rmq": "Oración eficaz",
    "ro": "Rugăciune eficientă",
    "ru": "Действенная молитва",
    "sn": "Munyengetero Unobudirira",
    "sq": "Lutja efektive",
    "sr": "Делотворна молитва",
    "sv": "Verksam bön",
    "sw": "Sala Yenye Ufanisi",
    "syr": "صلاة فعالة",
    "th": "คำอธิษฐานที่เกิดผล",
    "tl": "Mabisang Panalangin",
    "tlh": "Effective Prayer",
    "tpi": "Gutpela Beten",
    "tr": "Etkili Dua",
    "tsg": "Mabisang Panalangin",
    "uk": "Ефективна молитва",
    "vi": "Cầu nguyện hiệu quả",
    "zh": "有功效的祷告",
    "zh-hans": "有功效的祷告",
    "zh-hant": "有功效的禱告"
  },
  "verses": [
    [2, 33, 20],
    [5, 3, 26],
    [9, 28, 6],
    [10, 12, 16],
    [18, 34, 28],
    [19, 4, 3],
    [19, 4, 4],
    [19, 18, 6],
    [19, 34, 17],
    [19, 66, 18],
    [19, 109, 6],
    [19, 109, 7],
    [20, 15, 8],
    [20, 15, 29],
    [20, 28, 9],
    [23, 1, 15],
    [23, 59, 2],
    [24, 7, 16],
    [24, 11, 14],
    [26, 20, 3],
    [27, 9, 16],
    [32, 2, 7],
    [33, 7, 7],
    [38, 10, 6],
    [40, 21, 22],
    [41, 11, 24],
    [43, 9, 31],
    [43, 14, 13],
    [43, 14, 14],
    [43, 16, 23],
    [43, 16, 24],
    [47, 12, 8],
    [49, 3, 20],
    [59, 1, 6],
    [59, 4, 3],
    [60, 3, 12]
  ]
}
