{
  "schema_version": 1,
  "id": "renewing-of-the-mind",
  "name": "Renewing of the Mind",
  "color": "#a5f3fc",
  "aliases": [],
  "default": true,
  "names": {
    "af": "Vernuwing van die verstand",
    "ar": "تجديد العقل",
    "br": "Nevezadur ar spered",
    "ch": "Rininueba i Hinasso",
    "cs": "Obnova mysli",
    "da": "Sindets fornyelse",
    "de": "Erneuerung des Sinnes",
    "el": "Ανανέωση του νου",
    "en": "Renewing of the Mind",
    "eo": "Renovigo de la Menso",
    "es": "Renovación de la mente",
    "et": "Meele uuendamine",
    "eu": "Adimena berritzea",
    "fi": "Mielen uudistuminen",
    "fr": "Renouvellement de l’esprit",
    "gd": "Ath-nuadhachadh na h-inntinn",
    "gv": "Aavooghey yn aigney",
    "hbo": "חידוש השכל",
    "hr": "Obnova uma",
    "hu": "Az elme megújulása",
    "hy": "Մտքի նորոգում",
    "id": "Pembaruan Pikiran",
    "it": "Rinnovamento della mente",
    "ja": "心の刷新",
    "ko": "마음의 새로워짐",
    "la": "Renovatio mentis",
    "lt": "Proto atnaujinimas",
    "lv": "Prāta atjaunošana",
    "mg": "Fanavaozana ny saina",
    "mi": "Te Whakahoutanga o te Hinengaro",
    "mn": "Оюун санааны шинэчлэл",
    "my": "စိတ်နှလုံးအသစ်ပြုပြင်ခြင်း",
    "nb": "Fornyelse av sinnet",
    "nd": "Ukuvuselelwa kwengqondo",
    "nl": "Vernieuwing van het denken",
    "nn": "Fornying av sinnet",
    "pl": "Odnowienie umysłu",
    "prs": "تجدید ذهن",
    "pt": "Renovação da mente",
    "ro": "Înnoirea minții",
    "ru": "Обновление ума",
    "sn": "Kuvandudzwa kwePfungwa",
    "sq": "Ripërtëritja e mendjes",
    "sr": "Обнављање ума",
    "sv": "Sinnets förnyelse",
    "sw": "Upya wa Akili",
    "th": "การเปลี่ยนแปลงจิตใจใหม่",
    "tl": "Pagbabago ng Isip",
    "tpi": "Mekim Tingting i kamap nupela gen",
    "tr": "Zihnin Yenilenmesi",
    "uk": "Оновлення розуму",
    "vi": "Đổi mới tâm trí",
    "zh": "心意更新",
    "zh-hant": "心意更新"
  },
  "verses": [
    [20, 2, 1],
    [20, 2, 2],
    [20, 2, 3],
    [20, 2, 4],
    [20, 2, 5],
    [20, 23, 7],
    [45, 8, 5],
    [45, 8, 29],
    [45, 11, 33],
    [45, 12, 2],
    [47, 3, 18],
    [47, 10, 5],
    [49, 1, 18],
    [49, 4, 23],
    [50, 2, 5],
    [50, 4, 8],
    [51, 3, 10],
    [60, 1, 13],
    [60, 2, 2]
  ]
}
