{
  "schema_version": 1,
  "id": "saved-by-faith",
  "name": "Saved by Faith",
  "color": "#86efac",
  "aliases": [],
  "default": true,
  "names": {
    "af": "Gered deur geloof",
    "ar": "الخلاص بالإيمان",
    "br": "Salvet dre ar feiz",
    "ch": "Manma'åse' put i hinengge",
    "cs": "Spaseni vírou",
    "da": "Frelst ved tro",
    "de": "Durch Glauben gerettet",
    "el": "Σωτηρία μέσω πίστης",
    "en": "Saved by Faith",
    "eo": "Savita per fido",
    "es": "Salvado por la fe",
    "et": "Päästetud usu läbi",
    "eu": "Fedearen bidez salbatua",
    "fi": "Pelastus uskosta",
    "fr": "Sauvé par la foi",
    "gd": "Air a shàbhaladh tro chreideamh",
    "gv": "Sauailt trooid credjue",
    "hbo": "נושע באמונה",
    "hr": "Spašeni vjerom",
    "hu": "Hit által üdvözülve",
    "hy": "Հավատքով փրկված",
    "id": "Diselamatkan oleh Iman",
    "it": "Salvati per fede",
    "ja": "信仰による救い",
    "ko": "믿음으로 얻는 구원",
    "la": "Fide salvatus",
    "lt": "Išgelbėti tikėjimu",
    "lv": "Glābti ticībā",
    "mg": "Voavonjy amin’ny Finoana",
    "mi": "Whakaorangia e te Whakapono",
    "mn": "Итгэлээр аврагдсан",
    "my": "ယုံကြည်ခြင်းဖြင့်ကယ်တင်ခြင်း",
    "nb": "Frelst ved tro",
    "nd": "Usindiswe ngokukholwa",
    "nl": "Gered door geloof",
    "nn": "Frelsa ved tru",
    "pl": "Zbawieni przez wiarę",
    "prs": "توسط ایمان نجات یافت",
    "pt": "Salvo pela fé",
    "ro": "Mântuit prin credință",
    "ru": "Спасение по вере",
    "sn": "Kuponeswa neKutenda",
    "sq": "Shpëtuar me anë të besimit",
    "sr": "Спасени вером",
    "sv": "Frälst genom tro",
    "sw": "Kuokolewa kwa Imani",
    "th": "รอดโดยความเชื่อ",
    "tl": "Iniligtas ng Pananampalataya",
    "tpi": "Bilip i kisim bek",
    "tr": "İmanla Kurtuluş",
    "uk": "Спасіння вірою",
    "vi": "Được cứu bởi đức tin",
    "zh": "因信得救",
    "zh-hant": "因信得救"
  },
  "verses": [
    [42, 5, 20],
    [42, 7, 50],
    [42, 18, 42],
    [45, 5, 1],
    [45, 5, 2],
    [45, 10, 9],
    [45, 10, 10],
    [45, 10, 11],
    [45, 10, 12],
    [45, 10, 13],
    [45, 10, 14],
    [48, 2, 16],
    [48, 2, 17],
    [48, 2, 18],
    [48, 2, 19],
    [48, 2, 20],
    [48, 2, 21],
    [48, 3, 1],
    [48, 3, 2],
    [48, 3, 3],
    [48, 3, 4],
    [48, 3, 5],
    [48, 3, 6],
    [48, 3, 7],
    [48, 3, 8],
    [48, 3, 9],
    [48, 3, 10],
    [48, 3, 11],
    [48, 3, 12],
    [48, 3, 13],
    [48, 3, 14],
    [48, 5, 5],
    [49, 2, 8],
    [58, 10, 38],
    [58, 10, 39]
  ]
}
