{
  "schema_version": 1,
  "id": "spirit-of-prophecy",
  "name": "Spirit of Prophecy",
  "color": "#d8b4fe",
  "aliases": [],
  "default": true,
  "names": {
    "af": "Gees van profesie",
    "ar": "روح النبوة",
    "br": "Spered an diougan",
    "ch": "Espiritun Prufesia",
    "cs": "Duch proroctví",
    "da": "Profetiens ånd",
    "de": "Geist der Prophetie",
    "el": "Πνεύμα προφητείας",
    "en": "Spirit of Prophecy",
    "eo": "Spirito de Profetaĵo",
    "es": "Espíritu de profecía",
    "et": "Prohvetikuulutuse vaim",
    "eu": "Profeziaren espiritua",
    "fi": "Profetian henki",
    "fr": "Esprit de prophétie",
    "gd": "Spiorad na fàidheadaireachd",
    "gv": "Spyrryd y phadeyrys",
    "hbo": "רוח הנבואה",
    "hr": "Duh proroštva",
    "hu": "A prófétaság lelke",
    "hy": "Մարգարեության հոգի",
    "id": "Roh Nubuat",
    "it": "Spirito di profezia",
    "ja": "預言の霊",
    "ko": "예언의 영",
    "la": "Spiritus prophetiae",
    "lt": "Pranašystės dvasia",
    "lv": "Pravietojuma gars",
    "mg": "Fanahin’ny Faminaniana",
    "mi": "Wairua o te Poropiti",
    "mn": "Зөгнөлийн сүнс",
    "my": "အနာဂတ္တိစိတ်ဝိညာဉ်",
    "nb": "Profetiens ånd",
    "nd": "Umoya wesiPhorofido",
    "nl": "Geest van profetie",
    "nn": "Profetiens ånd",
    "pl": "Duch proroctwa",
    "prs": "روح نبوت",
    "pt": "Espírito de profecia",
    "ro": "Duhul prorociei",
    "ru": "Дух пророчества",
    "sn": "Mweya weChiporofita",
    "sq": "Fryma e profecisë",
    "sr": "Дух пророштва",
    "sv": "Profetians ande",
    "sw": "Roho ya Unabii",
    "th": "วิญญาณแห่งคำพยากรณ์",
    "tl": "Espiritu ng Propesiya",
    "tpi": "Spirit bilong tok profet",
    "tr": "Peygamberlik Ruhu",
    "uk": "Дух пророцтва",
    "vi": "Thần của lời tiên tri",
    "zh": "预言之灵",
    "zh-hant": "預言之靈"
  },
  "verses": [
    [1, 3, 15],
    [19, 2, 7],
    [19, 2, 12],
    [19, 22, 1],
    [19, 22, 6],
    [19, 22, 7],
    [19, 22, 8],
    [19, 22, 12],
    [19, 22, 14],
    [19, 22, 15],
    [19, 22, 16],
    [19, 22, 17],
    [19, 22, 18],
    [20, 30, 4],
    [23, 7, 14],
    [23, 9, 6],
    [23, 11, 1],
    [23, 11, 2],
    [23, 53, 1],
    [23, 53, 2],
    [23, 53, 3],
    [23, 53, 4],
    [23, 53, 5],
    [23, 53, 6],
    [23, 53, 7],
    [23, 53, 8],
    [23, 53, 9],
    [23, 53, 10],
    [23, 53, 11],
    [23, 53, 12],
    [40, 1, 22],
    [40, 1, 23],
    [40, 2, 15]
  ]
}
