{
  "schema_version": 1,
  "id": "wisdom-origin",
  "name": "Wisdom Origin",
  "color": "#fcd34d",
  "aliases": [],
  "default": true,
  "names": {
    "af": "Oorsprong van wysheid",
    "ar": "أصل الحكمة",
    "br": "Orin ar furnez",
    "ch": "I tutuhon i tiningo'",
    "chr": "Wisdom Origin",
    "cop": "أصل الحكمة",
    "cs": "Původ moudrosti",
    "cu": "Источник мудрости",
    "da": "Visdommens oprindelse",
    "de": "Ursprung der Weisheit",
    "el": "Πηγή της σοφίας",
    "en": "Wisdom Origin",
    "enm": "Wisdom Origin",
    "eo": "Origino de saĝo",
    "es": "Origen de la sabiduría",
    "et": "Tarkuse päritolu",
    "eu": "Jakinduria Jatorria",
    "fi": "Viisauden alkuperä",
    "fr": "Origine de la sagesse",
    "gd": "Tùs a' ghliocais",
    "got": "Ursprung der Weisheit",
    "grc": "Πηγή της σοφίας",
    "gv": "Bun y chreenaght",
    "hbo": "מקור החכמה",
    "he": "מקור החכמה",
    "hr": "Podrijetlo mudrosti",
    "hu": "A bölcsesség eredete",
    "hy": "Իմաստության ծագումը",
    "it": "Origine della sapienza",
    "ja": "知恵の起源",
    "ko": "지혜의 근원",
    "la": "Origo sapientiae",
    "lt": "Išminties kilmė",
    "lv": "Gudrības izcelsme",
    "mg": "Fiavian'ny fahendrena",
    "mi": "Takenga whakaaro nui",
    "mlf": "Wisdom Origin",
    "mn": "Мэргэн ухааны гарал үүсэл",
    "my": "ပညာ၏အရင်းအမြစ်",
    "nb": "Visdommens opphav",
    "nd": "Umsuka wokuhlakanipha",
    "nl": "Oorsprong van wijsheid",
    "nn": "Opphavet til visdom",
    "pl": "Pochodzenie mądrości",
    "pon": "Wisdom Origin",
    "pot": "Wisdom Origin",
    "ppk": "Asal Hikmah",
    "prs": "منشاء خرد",
    "pt": "Origem da sabedoria",
    "rmq": "Origen de la sabiduría",
    "ro": "Originea înțelepciunii",
    "ru": "Источник мудрости",
    "sn": "Mavambo euchenjeri",
    "sq": "Origjina e Urtësisë",
    "sr": "Порекло мудрости",
    "sv": "Vishetens ursprung",
    "sw": "Asili ya Hekima",
    "syr": "أصل الحكمة",
    "th": "ต้นกำเนิดของปัญญา",
    "tl": "Pinagmulan ng Karunungan",
    "tlh": "Wisdom Origin",
    "tpi": "As bilong savetingting",
    "tr": "Bilgeliğin Kökeni",
    "tsg": "Pinagmulan ng Karunungan",
    "uk": "Походження мудрості",
    "vi": "Nguồn gốc của sự khôn ngoan",
    "zh": "智慧的源头",
    "zh-hans": "智慧的源头",
    "zh-hant": "智慧的源頭"
  },
  "verses": [
    [2, 28, 3],
    [2, 31, 3],
    [11, 4, 29],
    [11, 4, 30],
    [18, 12, 12],
    [18, 12, 13],
    [20, 1, 20],
    [20, 1, 21],
    [20, 1, 22],
    [20, 1, 23],
    [20, 15, 33],
    [21, 2, 26],
    [21, 9, 10],
    [21, 9, 11],
    [21, 9, 12],
    [21, 9, 13],
    [21, 9, 14],
    [21, 9, 15],
    [21, 9, 16],
    [21, 9, 17],
    [21, 9, 18],
    [23, 11, 1],
    [23, 11, 2],
    [27, 1, 17],
    [27, 1, 20],
    [27, 2, 20],
    [27, 2, 21],
    [27, 2, 22],
    [27, 2, 23],
    [40, 7, 24],
    [40, 7, 25],
    [40, 7, 26],
    [40, 7, 27],
    [42, 2, 40],
    [42, 21, 15],
    [45, 11, 33],
    [46, 1, 24],
    [46, 1, 30],
    [59, 1, 5]
  ]
}
