{
  "schema_version": 1,
  "id": "baptism",
  "name": "Baptism",
  "color": "#7dd3fc",
  "aliases": [],
  "default": true,
  "names": {
    "af": "Doop",
    "ar": "المعمودية",
    "br": "Badeziant",
    "ch": "Tinaitai",
    "cs": "Křest",
    "da": "Dåb",
    "de": "Taufe",
    "el": "Βάπτισμα",
    "en": "Baptism",
    "eo": "Bapto",
    "es": "Bautismo",
    "et": "Ristimine",
    "eu": "Bataioa",
    "fi": "Kaste",
    "fr": "Baptême",
    "gd": "Baisteadh",
    "gv": "Bashtey",
    "hbo": "טבילה",
    "hr": "Krštenje",
    "hu": "Keresztség",
    "hy": "Մկրտություն",
    "id": "Baptisan",
    "it": "Battesimo",
    "ja": "洗礼",
    "ko": "세례",
    "la": "Baptismus",
    "lt": "Krikštas",
    "lv": "Kristības",
    "mg": "Batisa",
    "mi": "Te iriiringa",
    "mn": "Баптисм хүртэх",
    "my": "ဗတ္တိဇံ",
    "nb": "Dåp",
    "nd": "Ukubhajadiswa",
    "nl": "Doop",
    "nn": "Dåp",
    "pl": "Chrzest",
    "prs": "تعمید",
    "pt": "Batismo",
    "ro": "Botez",
    "ru": "Крещение",
    "sn": "Rubhabhatidzo",
    "sq": "Pagëzimi",
    "sr": "Крштење",
    "sv": "Dop",
    "sw": "Ubatizo",
    "th": "บัพติศมา",
    "tl": "Binyag",
    "tpi": "Baptais",
    "tr": "Vaftiz",
    "uk": "Хрещення",
    "vi": "Báp-têm",
    "zh": "洗礼",
    "zh-hant": "洗禮"
  },
  "verses": [
    [40, 3, 6],
    [40, 3, 11],
    [40, 3, 13],
    [40, 28, 19],
    [41, 1, 4],
    [41, 1, 8],
    [41, 16, 16],
    [42, 3, 12],
    [42, 3, 16],
    [42, 3, 21],
    [42, 7, 29],
    [42, 7, 30],
    [43, 1, 25],
    [43, 1, 26],
    [43, 1, 27],
    [43, 3, 5],
    [43, 3, 23],
    [44, 2, 38],
    [44, 2, 41],
    [44, 8, 12],
    [44, 8, 36],
    [44, 8, 37],
    [44, 8, 38],
    [44, 9, 18],
    [44, 10, 47],
    [44, 10, 48],
    [44, 16, 14],
    [44, 16, 15],
    [44, 16, 31],
    [44, 18, 8],
    [44, 19, 3],
    [44, 19, 4],
    [44, 19, 5],
    [44, 22, 16],
    [45, 6, 3],
    [45, 6, 4],
    [46, 10, 2],
    [46, 12, 13],
    [48, 3, 27],
    [49, 4, 5],
    [51, 2, 12],
    [56, 3, 5],
    [58, 6, 2],
    [60, 3, 20],
    [60, 3, 21]
  ]
}
